{
    "$schema": "./config_schema.json",
    "ms2rescore": {
        "feature_generators": [
            "ms2pip",
            "deeplc"
        ],
        "rescoring_engine": "percolator",
        "config_file": null,
        "psm_file": null,
        "psm_file_type": "infer",
        "tmp_path": null,
        "spectrum_path": null,
        "output_path": null,
        "log_level": "info",
        "id_decoy_pattern": null,
        "psm_id_pattern": null,
        "spectrum_id_pattern": null,
        "lower_score_is_better": false,
        "modification_mapping": {},
        "fixed_modifications": {},
        "processes": -1,
        "USI": false
    },
    "ms2pip": {
        "model": "HCD",
        "ms2_tolerance": 0.02
    },
    "deeplc": {},
    "percolator": {}
}
